{
  "$schema": "./index.schema.json",
  "version": "5.2.4",
  "status": "active",
  "requiredCloseoutPaths": [
    "ROUTER.md",
    "ARCHITECTURE.md",
    "流程管理/任务管理.md",
    "流程管理/验收清单.md",
    "流程管理/版本控制.md"
  ],
  "planRoot": "流程管理/执行计划",
  "productDemandPool": "产品管理/需求变更记录.md",
  "engineeringScopeLedger": "流程管理/需求与范围变更记录.md",
  "architectureSource": "ARCHITECTURE.md",
  "knowledgeSyncRecord": "知识管理/同步记录.md",
  "handoffRecord": "流程管理/上下文交接记录.md",
  "memoryRules": "MEMORY.md",
  "shortMemory": "SHORT_MEMORY.md",
  "longMemory": "LONG_MEMORY.md",
  "memoryPolicy": ".codex/harness/memory-policy.json",
  "planDisclosureState": ".codex/harness/plan-disclosure-state.json",
  "planDisclosureSchema": ".codex/harness/plan-disclosure-state.schema.json",
  "knowledgeRouter": "知识管理/KnowledgeRouter.md",
  "ledgerRetention": ".codex/harness/ledger-retention.json",
  "historyIndex": "流程管理/历史记录库/INDEX.md",
  "documentControllerRegistry": ".codex/harness/document-controllers.json",
  "lifecycleStateMachine": ".codex/harness/lifecycle-state-machine.json",
  "runtimeEventLog": ".codex/harness/runtime-events.jsonl",
  "performancePolicy": ".codex/harness/performance-policy.json",
  "performancePolicySchema": ".codex/harness/performance-policy.schema.json",
  "sourceLayoutManifest": ".codex/harness/source-layout.json",
  "sourceLayoutRequired": false
}
